[
  {
    "schema_version": "customer-report/1.0",
    "scope": {
      "organization_id": "DEMO-ORG",
      "case_id": "DEMO-CASE",
      "assessment_id": "RA-SYNTHETIC-new012",
      "assessment_version": 1,
      "customer_party_id": "new012-investor",
      "application_id": "SYNTHETIC-new012",
      "as_of": "2026-10-29T12:00:00Z",
      "purpose": "CustomerAML"
    },
    "run_manifest": {
      "run_id": "cf9e3e93-cc44-49b0-8534-d0b2b99d74f3",
      "input_snapshot_id": "4fad2cbf7ad5ce32c7fb7b231dbfbc112730499238ebb5128ba8a1fe746883e6",
      "input_snapshot_hash": "4fad2cbf7ad5ce32c7fb7b231dbfbc112730499238ebb5128ba8a1fe746883e6",
      "rule_pack_hash": "f91d21cb95150f74acda34e6b14a797c346e4a6a987af13983271fe777891fd2",
      "workbook_sha256": {
        "IS4920_Integrated_HardGate_RiskFactors_RiskBand.xlsx": "a24e5f8beb6fc1b714f09c0a2824be932f8cddc33f42846ef97d31ddce172670",
        "IS4920_AML_Appetite_Safeguards.xlsx": "8340ea60dde72d4e36e3844323349f46ffbca92e8fd56e519204699eca4a4b47",
        "IS4920_Policy_Integration_Final_Step.xlsx": "4f520c3b9d31fbb7e2acc4772779c26224a296c2e71b60ccb64f512855614694"
      },
      "engine_version": "customer-contract-1",
      "runtime_versions": {
        "python": "3.12.14",
        "openpyxl": "3.1.5",
        "jsonschema": "4.26.0",
        "langgraph": "1.2.16"
      },
      "schema_sha256": {
        "customer-assessment.schema.json": "24f5c40916557a58560ba152e5334d7df8e850612228e302d8c0964a8a5143c4",
        "report-payload.schema.json": "97d9e76a7134539efdebaf41f61204c4705daebe310a463036bfab3187e2aac0",
        "supported-rule-pack.json": "9eda19e7b89e1dd4d79b1af51872c3e0b7a9606b370107c949f03b08a91b5ff7"
      },
      "engine_sha256": {
        "policy_engine.py": "f4d4395da227537f567c80205313a8ee9d8457b86e5ea61329d4c245c61d1d29",
        "customer_ontology.py": "73423686c5c9890caf18d93c75b6a021ece2d3f3e2e245635fd67881ebbb4483",
        "ownership.py": "e529d2c892e70de4a75570397dd56d115e16dda120907cafaae30a6eb08f4ad3",
        "kyc_poc.py": "d710856e1240367131ef86660272f9cbc31ce5782d9002bf778d0be49f62b1b3",
        "workflow_graph.py": "102c45a899b85e0170c9de1b457280470cc4eaf6bd9030a55f68a7b24d1cebad"
      },
      "evaluated_at": "2026-10-29T15:12:03.936024+00:00",
      "supersedes_snapshot_id": null
    },
    "input_snapshot": {
      "Application": {
        "application_id": "SYNTHETIC-new012",
        "submission_date": "2026-10-06",
        "application_status": "UnderReview"
      },
      "party1": {
        "party_id": "new012-investor",
        "person_id": "case01-P1-PER",
        "full_name": "SYNTHETIC RF-12 confirmed factor",
        "is_ubo": false,
        "is_nominee": false,
        "is_trust": false,
        "sanctions_flag": false,
        "shareholding_percentage": 100.0,
        "pep_status": "None",
        "nationality": "GB",
        "registration_jurisdiction": "GB"
      },
      "party2": [
        {
          "party_id": "DEMO-OWNER",
          "person_id": "DEMO-PERSON",
          "full_name": "Synthetic Owner",
          "entity_type": "NaturalPerson",
          "is_ubo": true,
          "shareholding_percentage": 100
        }
      ],
      "Industry": {
        "industry_id": "case01-IND",
        "industry_name": "Standard Risk Industries",
        "industry_tier": "I1"
      },
      "WatchList": [],
      "Document": [
        {
          "document_id": "case01-DOC-01",
          "document_type": "Certificate of Incorporation",
          "status": "Provided",
          "fact_verified": "legal_existence",
          "is_mandatory": true
        },
        {
          "document_id": "case01-DOC-02",
          "document_type": "Shareholder Register",
          "status": "Provided",
          "fact_verified": "shareholding_pct",
          "is_mandatory": true
        },
        {
          "document_id": "case01-DOC-03",
          "document_type": "Director Declaration",
          "status": "Provided",
          "fact_verified": "director_identity",
          "is_mandatory": true
        },
        {
          "document_id": "case01-DOC-04",
          "document_type": "Audited Financial Statements",
          "status": "Provided",
          "fact_verified": "financial_position",
          "is_mandatory": false
        }
      ],
      "regulated_activity": false,
      "licence_status": "NotApplicable",
      "ubo_verification": "Verified",
      "control_verification": "Verified",
      "illicit_activity_confirmed": false,
      "fraud_confirmed": false,
      "hardgate_pending": false,
      "ownership_evidence_complete": true,
      "industry_data_sufficient": true,
      "cross_entity_structure": false,
      "control_rights_discrepancy_unexplained": false,
      "structural_explanation_adequate": true,
      "multiple_high_risk_activities": false,
      "incorporation_date": "2015-06-01",
      "high_leverage": false,
      "negative_cash_flow": false,
      "net_assets_sufficient": true,
      "officer_decision": "Approved",
      "safeguards_completed": [],
      "WorkflowEvidence": {
        "assessment_id": "RA-SYNTHETIC-new012",
        "risk_factors": {
          "RF-01": {
            "status": "Clear",
            "verified": true,
            "evidence_refs": [
              "demo-evidence"
            ]
          },
          "RF-02": {
            "status": "Clear",
            "verified": true,
            "evidence_refs": [
              "demo-evidence"
            ]
          },
          "RF-03": {
            "status": "Clear",
            "verified": true,
            "evidence_refs": [
              "demo-evidence"
            ]
          },
          "RF-04": {
            "status": "Clear",
            "verified": true,
            "evidence_refs": [
              "demo-evidence"
            ]
          },
          "RF-05": {
            "status": "Clear",
            "verified": true,
            "evidence_refs": [
              "demo-evidence"
            ]
          },
          "RF-06": {
            "status": "Clear",
            "verified": true,
            "evidence_refs": [
              "demo-evidence"
            ]
          },
          "RF-07": {
            "status": "Clear",
            "verified": true,
            "evidence_refs": [
              "demo-evidence"
            ]
          },
          "RF-08": {
            "status": "Clear",
            "verified": true,
            "evidence_refs": [
              "demo-evidence"
            ]
          },
          "RF-09": {
            "status": "Clear",
            "verified": true,
            "evidence_refs": [
              "demo-evidence"
            ]
          },
          "RF-10": {
            "status": "Clear",
            "verified": true,
            "evidence_refs": [
              "demo-evidence"
            ]
          },
          "RF-11": {
            "status": "Clear",
            "verified": true,
            "evidence_refs": [
              "demo-evidence"
            ]
          },
          "RF-12": {
            "status": "Hit",
            "verified": true,
            "evidence_refs": [
              "demo-evidence"
            ]
          },
          "RF-13": {
            "status": "Clear",
            "verified": true,
            "evidence_refs": [
              "demo-evidence"
            ]
          },
          "RF-14": {
            "status": "Clear",
            "verified": true,
            "evidence_refs": [
              "demo-evidence"
            ]
          },
          "RF-15": {
            "facts": {
              "intermediate_legal_entity_count": 0
            },
            "verified": true,
            "evidence_refs": [
              "demo-evidence"
            ]
          },
          "RF-16": {
            "status": "Clear",
            "verified": true,
            "evidence_refs": [
              "demo-evidence"
            ]
          },
          "RF-17": {
            "status": "Clear",
            "verified": true,
            "evidence_refs": [
              "demo-evidence"
            ]
          },
          "RF-18": {
            "status": "Clear",
            "verified": true,
            "evidence_refs": [
              "demo-evidence"
            ]
          },
          "RF-19": {
            "status": "Clear",
            "verified": true,
            "evidence_refs": [
              "demo-evidence"
            ]
          },
          "RF-20": {
            "status": "Clear",
            "verified": true,
            "evidence_refs": [
              "demo-evidence"
            ]
          },
          "RF-21": {
            "status": "Clear",
            "verified": true,
            "evidence_refs": [
              "demo-evidence"
            ]
          }
        },
        "D1": {
          "evidence_complete": true,
          "evidence_refs": [
            "demo-evidence"
          ],
          "facts": {
            "legal_entity_verified": true,
            "ownership_links_verified": true,
            "ubo_verified": true,
            "control_verified": true,
            "intermediate_legal_entity_count": 0,
            "complex_ownership": false,
            "nominee_or_trust": false,
            "cross_entity_or_border_complexity": false,
            "control_rights_discrepancy": false,
            "unusual_structure": false,
            "material_unresolved_contradiction": false
          }
        },
        "D2": {
          "evidence_complete": true,
          "evidence_refs": [
            "demo-evidence"
          ],
          "facts": {
            "activity_verified": true,
            "taxonomy_approved": true,
            "category": "Standard",
            "regulated": false,
            "material_discrepancy": false,
            "material_high_risk_activity": false
          }
        },
        "D3": {
          "evidence_complete": true,
          "evidence_refs": [
            "demo-evidence"
          ],
          "facts": {